{
  "id": "https://doi.org/10.1234/aide.2025.001",
  "created": "2025-09-23T08:15:00Z",
  "actor": {
    "name": "Dr Adam Vials Moore",
    "orcid": "https://orcid.org/0000-0002-2085-1908",
    "affiliation": {
      "name": "FAIR Research Consultancy and Management",
      "ror": "https://ror.org/03yrm5c26"
    }
  },
  "context": {
    "raid": "https://raid.org/10.9999/raid.123",
    "grantIdentifier": "UKRI-ABC-12345",
    "relatedOutputs": [
      "https://doi.org/10.5281/zenodo.1234567"
    ]
  },
  "usage": {
    "category": "writing",
    "purpose": "Drafting methods and summarising background literature.",
    "role": "author",
    "stage": "writing"
  },
  "model": {
    "name": "ChatGPT",
    "version": "GPT-4o mini",
    "provider": "OpenAI",
    "pid": "https://doi.org/10.9999/model.gpt4omini.v1",
    "hostingOrg": "https://ror.org/04b5b1a33"
  },
  "data": {
    "datasetDois": [
      "https://doi.org/10.5061/dryad.ab12c"
    ],
    "sourceDois": [
      "https://doi.org/10.1038/s41586-019-1234-5"
    ]
  },
  "prompts": {
    "promptClass": "methods_summariser_v1",
    "promptHash": "sha256:3d9c1a...",
    "outputHash": "sha256:7a1f2b...",
    "algorithm": "sha256"
  },
  "oversight": {
    "humanInTheLoop": true,
    "responsibleUse": true,
    "notes": "Outputs were edited and verified by the author."
  }
}