{
  "id": "https://doi.org/10.1234/aide.2025.002",
  "created": "2025-09-23T09:00:00Z",
  "actor": {
    "name": "Dr Adam Vials Moore",
    "orcid": "https://orcid.org/0000-0002-2085-1908",
    "affiliation": {
      "name": "FAIR Research Consultancy and Management",
      "ror": "https://ror.org/03yrm5c26"
    }
  },
  "usage": {
    "category": "information_seeking",
    "purpose": "Scoping recent literature and policy.",
    "role": "assistant",
    "stage": "proposal"
  },
  "model": {
    "name": "Claude",
    "version": "3.5 Sonnet",
    "provider": "Anthropic",
    "pid": "https://doi.org/10.9999/model.claude3p5.sonnet",
    "hostingOrg": "https://ror.org/05dbe0285"
  },
  "data": {
    "datasetDois": [],
    "sourceDois": [
      "https://doi.org/10.1371/journal.pone.0000001"
    ]
  },
  "oversight": {
    "humanInTheLoop": true,
    "responsibleUse": true
  }
}